{
  "acceptance_criterion": "Accept transfer of the E1 coefficient to the E2 reactive-core baseline if the arithmetic-mean SI_15_60 is between 7.51% and 11.51%, inclusive, corresponding to the H-CORE prediction of 9.51% within the declared 2.00-percentage-point resolution.",
  "architecture_version": "4.0.0",
  "candidate_set_hash": "54f825939d05a159b93eb39e98ccdd4d3a658b4a31fc8a5fff722770aadd24a1",
  "claim_boundary": "V4.0.0 selects an experiment from pre-result evidence under an outcome-blind runtime. Its adjudication tests whether a registered hypothesis survives contact with the completed measurement. It is not a contemporaneous pre-experimental record and does not claim that the historical decision used this ranking.",
  "decision_mode": "state_control_experiment",
  "experiment_card": {
    "acceptance_criterion": "Matched 15-60 min drift at 120 C stays below 4.75% across at least two repeats, i.e. below half the linear-dilution prediction of 9.51% implied by a reactive mass fraction of 1.0000. This accepts H-RESIN over H-CORE.",
    "acrylic_like_pct": 0.0,
    "candidate_id": "S1C01",
    "decision_relevance_detail": {
      "coverage_class": "no_intervention",
      "coverage_factor": 0.4,
      "covered_supported_axes": [],
      "measurement_decision_relevance": 1.0,
      "score": 0.4,
      "zeroed_supported_axes": [
        "acrylic_like",
        "minor_tackifier_like"
      ]
    },
    "experiment_id": "S1C01::M-HOLD-120",
    "extrapolation_risk_detail": {
      "mean_distance_pct": 0.0,
      "normalizer_pct": 12.0,
      "per_axis": {
        "acrylic_like": {
          "distance_pct": 0.0,
          "supported_region_pct": [
            15.0,
            25.0
          ],
          "value_pct": 0.0
        },
        "minor_tackifier_like": {
          "distance_pct": 0.0,
          "supported_region_pct": [
            4.8,
            6.4
          ],
          "value_pct": 0.0
        }
      },
      "score": 0.0
    },
    "falsification_criterion": "H-RESIN is falsified if matched 15-60 min drift is at or above the linear-dilution prediction of 9.51%. H-CORE is falsified if drift falls below 4.75%, a separation larger than the 2.00% resolution threshold. H-DUAL is falsified if this acrylic-only composition reaches the low-drift regime with no minor tackifier present.",
    "formulation_state": {
      "AC1920": 0.0,
      "MDI": 19.2866666667,
      "PDP70": 40.3566666667,
      "PPG2000": 40.3566666667,
      "TK100": 0.0,
      "amount_basis": "normalized_total_wt_percent",
      "design_layer": "measured_reactive_core_only"
    },
    "hypothesis_discrimination_detail": {
      "n_pairs": 3,
      "predictions_pct": {
        "H-CORE": 9.51,
        "H-DUAL": 9.51,
        "H-RESIN": 9.51
      },
      "resolution_threshold_pct": 2.0,
      "score": 0.0,
      "separated_pairs": []
    },
    "intervention_family": "reactive_core_only",
    "measurement_id": "M-HOLD-120",
    "measurement_plan": {
      "measurement_id": "M-HOLD-120",
      "min_repeats": 2,
      "name": "matched-window 120 C thermal hold",
      "primary_observable": "SI_15_60 = (eta_60 - eta_15) / eta_15, percent",
      "protocol": "Hold the melt at 120 C. Record viscosity at 15, 30, 45 and 60 min. Report the 15-60 min matched-window relative change. Run at least two independent repeats.",
      "sampling_times_min": [
        15,
        30,
        45,
        60
      ],
      "temperature_c": 120
    },
    "minor_tackifier_like_pct": 0.0,
    "process_state_risk_detail": {
      "base_before_measurement_plan": 0.75,
      "measurement_controls_process_state": false,
      "missing_process_fields": 6,
      "risk_level": "moderate",
      "score": 0.75
    },
    "reactive_mass_fraction": 1.0,
    "resin_modified": false,
    "scientific_hypotheses_addressed": [
      "H-CORE",
      "H-RESIN",
      "H-DUAL"
    ],
    "uncertainty_reduction_detail": {
      "novel_chemistry": false,
      "novel_chemistry_factor": 0.45,
      "resolves_quantity": "isothermal time coordinate S_t",
      "score": 0.405,
      "unresolved_prior": 0.9
    },
    "voi_components": {
      "decision_relevance": 0.4,
      "extrapolation_risk": 0.0,
      "hypothesis_discrimination": 0.0,
      "measurement_interpretability": 1.0,
      "process_state_risk": 0.75,
      "uncertainty_reduction": 0.405
    },
    "voi_score": 0.2435
  },
  "falsification_criterion": "If arithmetic-mean SI_15_60 is below 7.51%, falsify H-CORE's registered linear prediction for the E2 core because drift is more than 2.00 percentage points below 9.51%. A mean from 7.51% through 11.51% falsifies none of H-CORE, H-RESIN, or H-DUAL. A mean above 11.51% rejects numerical transfer of the 9.51% coefficient but does not meet H-CORE's registered directional falsification condition; no outcome from this modifier-free control can falsify H-RESIN or H-DUAL.",
  "frozen_utc": "2026-09-24T16:27:58Z",
  "git_commit": "71bf7d9b20e5f8a529c762d2675d5b8d30130976",
  "hypotheses_addressed": [
    "H-CORE"
  ],
  "hypotheses_left_entangled": [
    "H-RESIN",
    "H-DUAL"
  ],
  "hypothesis_registry_hash": "2117be1a410f050eb8e2f2d000d069907652494eec699005bb4e0b0e67a36175",
  "input_hash": "40588c106b8267b26f95a137c01504fd971290c04c19b913578bbdd5f85e4f73",
  "inspection_status": "frozen_pre_result",
  "measurement_catalog_hash": "75c54e09dd8b2a3c9ca231f1caea27b6d93a8628474733a0bf6b907f02dd3a92",
  "model": "gpt-5.6-sol",
  "next_experiment_if_falsified": "Run S1C49::M-HOLD-120 with the same controlled process history and repeat aggregation, using the measured E2 mean drift\u2014not E1's 9.51%\u2014to preregister the S1C49 linear prediction as 0.80 \u00d7 E2 mean and the strong-suppression threshold as 0.40 \u00d7 E2 mean; first verify whether the acrylic contributes NCO-reactive functionality.",
  "primary_observable": "Arithmetic mean across at least two independent preparations of SI_15_60 = 100 \u00d7 (eta_60 - eta_15) / eta_15 at 120 C; retain each preparation's eta_15 and repeat-level SI_15_60.",
  "prompt_hash": "dc47194bf7ce3750d07e210da66915795069387765d2e21135425989e32b3e59",
  "rationale": "S1C01::M-HOLD-120 is the defensible control needed before interpreting acrylic-induced drift suppression. It directly measures the least-resolved isothermal-time coordinate, stays within measured support, preregisters repeat aggregation and numerical thresholds, and makes only a formulation-level rheological claim.",
  "recommendation_id": "EXP_V4_20260924T162758Z_68920161be",
  "selected_candidate_id": "S1C01",
  "selected_experiment_id": "S1C01::M-HOLD-120",
  "selected_measurement_id": "M-HOLD-120",
  "stage_disagreements_resolved": "Followed the Skeptic and Robustness Adjudicator rather than the Proposer. The Proposer's S1C49 acrylic-only probe directly targets the failure mode, but its central 7.608% comparator imports a single-run E1 drift coefficient into an E2-based formulation without an E2 hold baseline. Measuring S1C01 first removes that formulation-baseline ambiguity. S1C01 was chosen as the canonical entry among S1C01-S1C09, which are apparently composition-identical; the withheld deterministic ranking cannot resolve that tie.",
  "uncertainty_decomposition": {
    "evidence_coverage_uncertainty": "No prior E2 thermal-hold trajectory exists, so this experiment fills the principal baseline gap. It contains no resin modifier and therefore cannot adjudicate resin suppression or tackifier necessity.",
    "extrapolation_uncertainty": "The test remains at the locally observed 120 C temperature and 15-60 min window, so temporal and temperature extrapolation are avoided. Transfer from E1 to the compositionally distinct E2 core is precisely the assumption being checked.",
    "measurement_uncertainty": "M-HOLD-120 has a declared 2.00-percentage-point discrimination threshold. Use the preregistered arithmetic mean of at least two independent repeat-level SI_15_60 values; the single E1 reference run remains an additional uncertainty in coefficient transfer.",
    "realization_state_uncertainty": "E2 previously showed approximately 2.80-3.57-fold viscosity-scale variation between preparations. Fully record and control process history and retain eta_15 for every preparation; this card measures whether matched-window drift is transferable despite that starting-state variation."
  },
  "voi": {
    "components": {
      "decision_relevance": 0.4,
      "extrapolation_risk": 0.0,
      "hypothesis_discrimination": 0.0,
      "measurement_interpretability": 1.0,
      "process_state_risk": 0.75,
      "uncertainty_reduction": 0.405
    },
    "formula": "VOI = w_hyp * hypothesis_discrimination + w_unc * uncertainty_reduction + w_dec * decision_relevance + w_int * measurement_interpretability - w_ext * extrapolation_risk - w_proc * process_state_risk. Every component is normalized to [0, 1] by construction. This is a transparent normalized score with reported weight sensitivity, not a Bayesian posterior.",
    "score": 0.2435,
    "scores_withheld_from_model": true,
    "selected_is_in_tied_top_set": false,
    "tied_top_set": [
      "S1C41::M-HOLD-120",
      "S1C46::M-HOLD-120",
      "S1C51::M-HOLD-120",
      "S1C56::M-HOLD-120",
      "S1C61::M-HOLD-120"
    ],
    "weights": {
      "decision_relevance": 0.25,
      "extrapolation_risk": 0.1,
      "hypothesis_discrimination": 0.3,
      "measurement_interpretability": 0.1,
      "process_state_risk": 0.05,
      "uncertainty_reduction": 0.2
    }
  },
  "workflow_version": "1.2.0"
}
