{
  "acceptance_criterion": "Across at least two independent preparations, the mean SI_15_60 is between 7.51% and 11.51% inclusive, corresponding to agreement within the declared 2.00 percentage-point resolution of the H-CORE linear-dilution prediction of 9.51%.",
  "architecture_version": "4.0.0",
  "candidate_set_hash": "54f825939d05a159b93eb39e98ccdd4d3a658b4a31fc8a5fff722770aadd24a1",
  "claim_boundary": "V4.0.0 selects an experiment from pre-result evidence under an outcome-blind runtime. Its adjudication tests whether a registered hypothesis survives contact with the completed measurement. It is not a contemporaneous pre-experimental record and does not claim that the historical decision used this ranking.",
  "decision_mode": "discriminating_probe",
  "experiment_card": {
    "acceptance_criterion": "Matched 15-60 min drift at 120 C stays below 4.75% across at least two repeats, i.e. below half the linear-dilution prediction of 9.51% implied by a reactive mass fraction of 1.0000. This accepts H-RESIN over H-CORE.",
    "acrylic_like_pct": 0.0,
    "candidate_id": "S1C02",
    "decision_relevance_detail": {
      "coverage_class": "no_intervention",
      "coverage_factor": 0.4,
      "covered_supported_axes": [],
      "measurement_decision_relevance": 1.0,
      "score": 0.4,
      "zeroed_supported_axes": [
        "acrylic_like",
        "minor_tackifier_like"
      ]
    },
    "experiment_id": "S1C02::M-HOLD-120",
    "extrapolation_risk_detail": {
      "mean_distance_pct": 0.0,
      "normalizer_pct": 12.0,
      "per_axis": {
        "acrylic_like": {
          "distance_pct": 0.0,
          "supported_region_pct": [
            15.0,
            25.0
          ],
          "value_pct": 0.0
        },
        "minor_tackifier_like": {
          "distance_pct": 0.0,
          "supported_region_pct": [
            4.8,
            6.4
          ],
          "value_pct": 0.0
        }
      },
      "score": 0.0
    },
    "falsification_criterion": "H-RESIN is falsified if matched 15-60 min drift is at or above the linear-dilution prediction of 9.51%. H-CORE is falsified if drift falls below 4.75%, a separation larger than the 2.00% resolution threshold. H-DUAL is falsified if this acrylic-only composition reaches the low-drift regime with no minor tackifier present.",
    "formulation_state": {
      "AC1920": 0.0,
      "MDI": 20.1906730224,
      "PDP70": 39.9046634888,
      "PPG2000": 39.9046634888,
      "TK100": 0.0,
      "amount_basis": "normalized_total_wt_percent",
      "design_layer": "measured_reactive_core_only"
    },
    "hypothesis_discrimination_detail": {
      "n_pairs": 3,
      "predictions_pct": {
        "H-CORE": 9.51,
        "H-DUAL": 9.51,
        "H-RESIN": 9.51
      },
      "resolution_threshold_pct": 2.0,
      "score": 0.0,
      "separated_pairs": []
    },
    "intervention_family": "reactive_core_only",
    "measurement_id": "M-HOLD-120",
    "measurement_plan": {
      "measurement_id": "M-HOLD-120",
      "min_repeats": 2,
      "name": "matched-window 120 C thermal hold",
      "primary_observable": "SI_15_60 = (eta_60 - eta_15) / eta_15, percent",
      "protocol": "Hold the melt at 120 C. Record viscosity at 15, 30, 45 and 60 min. Report the 15-60 min matched-window relative change. Run at least two independent repeats.",
      "sampling_times_min": [
        15,
        30,
        45,
        60
      ],
      "temperature_c": 120
    },
    "minor_tackifier_like_pct": 0.0,
    "process_state_risk_detail": {
      "base_before_measurement_plan": 0.75,
      "measurement_controls_process_state": false,
      "missing_process_fields": 6,
      "risk_level": "moderate",
      "score": 0.75
    },
    "reactive_mass_fraction": 1.0,
    "resin_modified": false,
    "scientific_hypotheses_addressed": [
      "H-CORE",
      "H-RESIN",
      "H-DUAL"
    ],
    "uncertainty_reduction_detail": {
      "novel_chemistry": false,
      "novel_chemistry_factor": 0.45,
      "resolves_quantity": "isothermal time coordinate S_t",
      "score": 0.405,
      "unresolved_prior": 0.9
    },
    "voi_components": {
      "decision_relevance": 0.4,
      "extrapolation_risk": 0.0,
      "hypothesis_discrimination": 0.0,
      "measurement_interpretability": 1.0,
      "process_state_risk": 0.75,
      "uncertainty_reduction": 0.405
    },
    "voi_score": 0.2435
  },
  "falsification_criterion": "H-CORE is falsified if the mean SI_15_60 is below 7.51% or above 11.51%, because the result then differs from 9.51% by more than the declared 2.00 percentage-point resolution. In particular, a mean below 4.75% is a strong low-drift departure from H-CORE. This card cannot falsify H-RESIN or H-DUAL because neither modifier axis is present.",
  "frozen_utc": "2026-09-20T04:19:19Z",
  "git_commit": "38d6f638ce44759a5bbfd82fb01f42f931a6bcf6",
  "hypotheses_addressed": [
    "H-CORE"
  ],
  "hypotheses_left_entangled": [
    "H-RESIN",
    "H-DUAL"
  ],
  "hypothesis_registry_hash": "2117be1a410f050eb8e2f2d000d069907652494eec699005bb4e0b0e67a36175",
  "input_hash": "cdca4ada47344ccac2e421e3701927b72c5b2d747443261ff6b3436f1a078c9c",
  "inspection_status": "frozen_pre_result",
  "measurement_catalog_hash": "75c54e09dd8b2a3c9ca231f1caea27b6d93a8628474733a0bf6b907f02dd3a92",
  "model": "gpt-5.6-luna",
  "next_experiment_if_falsified": "Run a controlled matched-reactive-mass-fraction M-HOLD-120 comparison including the unmodified E2 core, an acrylic-only composition, a composition with non-zero minor tackifier-like modifier, and preferably the combined-modifier composition, with at least two independent preparations per composition and a common recorded preparation history.",
  "primary_observable": "SI_15_60 = (eta_60 - eta_15) / eta_15, percent, measured at 120 C over 15-60 minutes",
  "prompt_hash": "dc47194bf7ce3750d07e210da66915795069387765d2e21135425989e32b3e59",
  "rationale": "S1C02::M-HOLD-120 is a defensible baseline probe for whether the E2-centre reactive core agrees with the frozen 9.51% linear-dilution reference under the directly observed 120 C hold. It is not a modifier-mechanism test, so interpretation is restricted to H-CORE compatibility and baseline drift.",
  "recommendation_id": "EXP_V4_20260920T041919Z_999a94e748",
  "selected_candidate_id": "S1C02",
  "selected_experiment_id": "S1C02::M-HOLD-120",
  "selected_measurement_id": "M-HOLD-120",
  "stage_disagreements_resolved": "I followed the robustness adjudicator and proposer in selecting the E2-centre S1C02 anchor because it minimizes unsupported stoichiometric departure while directly measuring the unresolved hold-drift coordinate. I followed the skeptic in removing the proposer's invalid claims that this control can falsify H-RESIN or H-DUAL; those hypotheses remain entangled and untested here.",
  "uncertainty_decomposition": {
    "evidence_coverage_uncertainty": "High for H-RESIN and H-DUAL because S1C02 contains no acrylic-like or minor tackifier-like modifier; the experiment provides only a reactive-core baseline.",
    "extrapolation_uncertainty": "Low for the 15-60 minute, 120 C drift coordinate because the observable is measured directly in the established window; high for any inference about modifier behavior or molecular causes.",
    "measurement_uncertainty": "The matched-window observable is directly read from viscosity at 15, 30, 45 and 60 minutes, with a declared discrimination resolution of 2.00 percentage points; two repeats provide limited precision.",
    "realization_state_uncertainty": "Moderate to high: M-HOLD-120 does not control preparation history, and the supplied evidence shows substantial realization-dependent viscosity-scale spread. Drift may also vary with preparation state."
  },
  "voi": {
    "components": {
      "decision_relevance": 0.4,
      "extrapolation_risk": 0.0,
      "hypothesis_discrimination": 0.0,
      "measurement_interpretability": 1.0,
      "process_state_risk": 0.75,
      "uncertainty_reduction": 0.405
    },
    "formula": "VOI = w_hyp * hypothesis_discrimination + w_unc * uncertainty_reduction + w_dec * decision_relevance + w_int * measurement_interpretability - w_ext * extrapolation_risk - w_proc * process_state_risk. Every component is normalized to [0, 1] by construction. This is a transparent normalized score with reported weight sensitivity, not a Bayesian posterior.",
    "score": 0.2435,
    "scores_withheld_from_model": false,
    "selected_is_in_tied_top_set": false,
    "tied_top_set": [
      "S1C41::M-HOLD-120",
      "S1C46::M-HOLD-120",
      "S1C51::M-HOLD-120",
      "S1C56::M-HOLD-120",
      "S1C61::M-HOLD-120"
    ],
    "weights": {
      "decision_relevance": 0.25,
      "extrapolation_risk": 0.1,
      "hypothesis_discrimination": 0.3,
      "measurement_interpretability": 0.1,
      "process_state_risk": 0.05,
      "uncertainty_reduction": 0.2
    }
  },
  "workflow_version": "1.2.0"
}
