{
  "acceptance_criterion": "Run at least three independent E2 preparations under a controlled and recorded process history. Accept the state-control baseline if the maximum minus minimum SI_15_60 across preparations is no greater than 2.0 percentage points and the complete 15, 30, 45, and 60 min trajectories are available.",
  "architecture_version": "4.0.0",
  "candidate_set_hash": "54f825939d05a159b93eb39e98ccdd4d3a658b4a31fc8a5fff722770aadd24a1",
  "claim_boundary": "V4.0.0 selects an experiment from pre-result evidence under an outcome-blind runtime. Its adjudication tests whether a registered hypothesis survives contact with the completed measurement. It is not a contemporaneous pre-experimental record and does not claim that the historical decision used this ranking.",
  "decision_mode": "state_control_experiment",
  "experiment_card": {
    "acceptance_criterion": "Matched 15-60 min drift at 120 C stays below 4.75% across at least two repeats, i.e. below half the linear-dilution prediction of 9.51% implied by a reactive mass fraction of 1.0000. This accepts H-RESIN over H-CORE.",
    "acrylic_like_pct": 0.0,
    "candidate_id": "S1C01",
    "decision_relevance_detail": {
      "coverage_class": "no_intervention",
      "coverage_factor": 0.4,
      "covered_supported_axes": [],
      "measurement_decision_relevance": 1.0,
      "score": 0.4,
      "zeroed_supported_axes": [
        "acrylic_like",
        "minor_tackifier_like"
      ]
    },
    "experiment_id": "S1C01::M-HOLD-120",
    "extrapolation_risk_detail": {
      "mean_distance_pct": 0.0,
      "normalizer_pct": 12.0,
      "per_axis": {
        "acrylic_like": {
          "distance_pct": 0.0,
          "supported_region_pct": [
            15.0,
            25.0
          ],
          "value_pct": 0.0
        },
        "minor_tackifier_like": {
          "distance_pct": 0.0,
          "supported_region_pct": [
            4.8,
            6.4
          ],
          "value_pct": 0.0
        }
      },
      "score": 0.0
    },
    "falsification_criterion": "H-RESIN is falsified if matched 15-60 min drift is at or above the linear-dilution prediction of 9.51%. H-CORE is falsified if drift falls below 4.75%, a separation larger than the 2.00% resolution threshold. H-DUAL is falsified if this acrylic-only composition reaches the low-drift regime with no minor tackifier present.",
    "formulation_state": {
      "AC1920": 0.0,
      "MDI": 19.2866666667,
      "PDP70": 40.3566666667,
      "PPG2000": 40.3566666667,
      "TK100": 0.0,
      "amount_basis": "normalized_total_wt_percent",
      "design_layer": "measured_reactive_core_only"
    },
    "hypothesis_discrimination_detail": {
      "n_pairs": 3,
      "predictions_pct": {
        "H-CORE": 9.51,
        "H-DUAL": 9.51,
        "H-RESIN": 9.51
      },
      "resolution_threshold_pct": 2.0,
      "score": 0.0,
      "separated_pairs": []
    },
    "intervention_family": "reactive_core_only",
    "measurement_id": "M-HOLD-120",
    "measurement_plan": {
      "measurement_id": "M-HOLD-120",
      "min_repeats": 2,
      "name": "matched-window 120 C thermal hold",
      "primary_observable": "SI_15_60 = (eta_60 - eta_15) / eta_15, percent",
      "protocol": "Hold the melt at 120 C. Record viscosity at 15, 30, 45 and 60 min. Report the 15-60 min matched-window relative change. Run at least two independent repeats.",
      "sampling_times_min": [
        15,
        30,
        45,
        60
      ],
      "temperature_c": 120
    },
    "minor_tackifier_like_pct": 0.0,
    "process_state_risk_detail": {
      "base_before_measurement_plan": 0.75,
      "measurement_controls_process_state": false,
      "missing_process_fields": 6,
      "risk_level": "moderate",
      "score": 0.75
    },
    "reactive_mass_fraction": 1.0,
    "resin_modified": false,
    "scientific_hypotheses_addressed": [
      "H-CORE",
      "H-RESIN",
      "H-DUAL"
    ],
    "uncertainty_reduction_detail": {
      "novel_chemistry": false,
      "novel_chemistry_factor": 0.45,
      "resolves_quantity": "isothermal time coordinate S_t",
      "score": 0.405,
      "unresolved_prior": 0.9
    },
    "voi_components": {
      "decision_relevance": 0.4,
      "extrapolation_risk": 0.0,
      "hypothesis_discrimination": 0.0,
      "measurement_interpretability": 1.0,
      "process_state_risk": 0.75,
      "uncertainty_reduction": 0.405
    },
    "voi_score": 0.2435
  },
  "falsification_criterion": "If the maximum minus minimum SI_15_60 across the independent E2 preparations exceeds 2.0 percentage points, falsify the assumption that this baseline hold provides adequate state control for a clean modifier comparison; this result falsifies none of H-CORE, H-RESIN, or H-DUAL, but prevents their formulation-level adjudication from this baseline. If the baseline mean is otherwise obtained, the next formulation comparison must use that contemporaneous mean rather than the E1 value of 9.51%.",
  "frozen_utc": "2026-09-20T03:54:56Z",
  "git_commit": "71bf7d9b20e5f8a529c762d2675d5b8d30130976",
  "hypotheses_addressed": [
    "H-CORE"
  ],
  "hypotheses_left_entangled": [
    "H-RESIN",
    "H-DUAL"
  ],
  "hypothesis_registry_hash": "2117be1a410f050eb8e2f2d000d069907652494eec699005bb4e0b0e67a36175",
  "input_hash": "dee41d41eab1c68887485bb0984421f898f36ba2efbc4d2bac58007e45af6ff5",
  "inspection_status": "frozen_pre_result",
  "measurement_catalog_hash": "75c54e09dd8b2a3c9ca231f1caea27b6d93a8628474733a0bf6b907f02dd3a92",
  "model": "gpt-5.6-luna",
  "next_experiment_if_falsified": "Run S1C39::M-HOLD-120 with at least three independent preparations and a contemporaneous E2 M-HOLD-120 control in the same measurement batch; define the linear-dilution reference as the contemporaneous E2 mean multiplied by 0.85.",
  "primary_observable": "SI_15_60 = (eta_60 - eta_15) / eta_15, percent, measured at 120 C over 15-60 min",
  "prompt_hash": "dc47194bf7ce3750d07e210da66915795069387765d2e21135425989e32b3e59",
  "rationale": "The declared failure mode is thermal-hold drift, yet the proposed modifier comparison used an E1-derived reference for an E2-based candidate. A matched E2 hold is the smallest defensible experiment that removes this confound and quantifies whether preparation-state variation is small enough for subsequent formulation-level rheological adjudication. It does not by itself separate resin-modification or tackifier-dependence hypotheses, so those remain entangled.",
  "recommendation_id": "EXP_V4_20260920T035456Z_d67a2fb6fb",
  "selected_candidate_id": "S1C01",
  "selected_experiment_id": "S1C01::M-HOLD-120",
  "selected_measurement_id": "M-HOLD-120",
  "stage_disagreements_resolved": "I followed the Robustness Adjudicator and the Skeptic over the Proposer. The Proposer selected S1C39 using the E1 drift as its reference, but the Skeptic identified a high-severity E1-versus-E2 baseline confound and inadequate state control. The Robustness Adjudicator therefore preferred S1C01::M-HOLD-120 to establish the contemporaneous E2 baseline before interpreting a modifier result.",
  "uncertainty_decomposition": {
    "evidence_coverage_uncertainty": "The E2 hold drift is not currently measured in the supplied data, and no baseline hold trajectory exists for the candidate modifier axes.",
    "extrapolation_uncertainty": "None for the primary observable: the result is read directly within the measured 120 C and 15-60 min window. Extrapolation remains only in the later linear-dilution comparison if it is based on this baseline.",
    "measurement_uncertainty": "Direct matched-window viscosity-change measurement at four time points; use the declared 2.0 percentage-point discrimination threshold and retain all repeat trajectories.",
    "realization_state_uncertainty": "High; E2 showed approximately 2.80-3.57x matched-temperature viscosity-scale spread and up to 0.585 CV at 120 C, so preparation history must be controlled and recorded."
  },
  "voi": {
    "components": {
      "decision_relevance": 0.4,
      "extrapolation_risk": 0.0,
      "hypothesis_discrimination": 0.0,
      "measurement_interpretability": 1.0,
      "process_state_risk": 0.75,
      "uncertainty_reduction": 0.405
    },
    "formula": "VOI = w_hyp * hypothesis_discrimination + w_unc * uncertainty_reduction + w_dec * decision_relevance + w_int * measurement_interpretability - w_ext * extrapolation_risk - w_proc * process_state_risk. Every component is normalized to [0, 1] by construction. This is a transparent normalized score with reported weight sensitivity, not a Bayesian posterior.",
    "score": 0.2435,
    "scores_withheld_from_model": true,
    "selected_is_in_tied_top_set": false,
    "tied_top_set": [
      "S1C41::M-HOLD-120",
      "S1C46::M-HOLD-120",
      "S1C51::M-HOLD-120",
      "S1C56::M-HOLD-120",
      "S1C61::M-HOLD-120"
    ],
    "weights": {
      "decision_relevance": 0.25,
      "extrapolation_risk": 0.1,
      "hypothesis_discrimination": 0.3,
      "measurement_interpretability": 0.1,
      "process_state_risk": 0.05,
      "uncertainty_reduction": 0.2
    }
  },
  "workflow_version": "1.2.0"
}
