{
  "acceptance_criterion": "Run at least two independent repeats and calculate SI_15_60 for each. Accept the combined dual-axis intervention as supporting H-RESIN over H-CORE if every repeat has SI_15_60 < 3.80%, which is below half of the H-CORE linear-dilution prediction of 7.61% for reactive mass fraction 0.8000.",
  "architecture_version": "4.0.0",
  "candidate_set_hash": "54f825939d05a159b93eb39e98ccdd4d3a658b4a31fc8a5fff722770aadd24a1",
  "claim_boundary": "V4.0.0 selects an experiment from pre-result evidence under an outcome-blind runtime. Its adjudication tests whether a registered hypothesis survives contact with the completed measurement. It is not a contemporaneous pre-experimental record and does not claim that the historical decision used this ranking.",
  "decision_mode": "committed_experiment",
  "experiment_card": {
    "acceptance_criterion": "Matched 15-60 min drift at 120 C stays below 3.80% across at least two repeats, i.e. below half the linear-dilution prediction of 7.61% implied by a reactive mass fraction of 0.8000. This accepts H-RESIN over H-CORE.",
    "acrylic_like_pct": 15.0,
    "candidate_id": "S1C41",
    "decision_relevance_detail": {
      "coverage_class": "full_coverage",
      "coverage_factor": 1.0,
      "covered_supported_axes": [
        "acrylic_like",
        "minor_tackifier_like"
      ],
      "measurement_decision_relevance": 1.0,
      "score": 1.0,
      "zeroed_supported_axes": []
    },
    "experiment_id": "S1C41::M-HOLD-120",
    "extrapolation_risk_detail": {
      "mean_distance_pct": 0.0,
      "normalizer_pct": 12.0,
      "per_axis": {
        "acrylic_like": {
          "distance_pct": 0.0,
          "supported_region_pct": [
            15.0,
            25.0
          ],
          "value_pct": 15.0
        },
        "minor_tackifier_like": {
          "distance_pct": 0.0,
          "supported_region_pct": [
            4.8,
            6.4
          ],
          "value_pct": 5.0
        }
      },
      "score": 0.0
    },
    "falsification_criterion": "H-RESIN is falsified if matched 15-60 min drift is at or above the linear-dilution prediction of 7.61%. H-CORE is falsified if drift falls below 3.80%, a separation larger than the 2.00% resolution threshold. This composition carries both axes, so it cannot separate H-RESIN from H-DUAL; an acrylic-only hold is the follow-up required for that.",
    "formulation_state": {
      "AC1920": 15.0,
      "MDI": 16.1525384179,
      "PDP70": 31.923730791,
      "PPG2000": 31.923730791,
      "TK100": 5.0,
      "amount_basis": "normalized_total_wt_percent",
      "design_layer": "uniform_modifier_lattice_on_E2_core"
    },
    "hypothesis_discrimination_detail": {
      "n_pairs": 3,
      "predictions_pct": {
        "H-CORE": 7.608,
        "H-DUAL": 3.804,
        "H-RESIN": 3.804
      },
      "resolution_threshold_pct": 2.0,
      "score": 0.6666666666666666,
      "separated_pairs": [
        [
          "H-CORE",
          "H-RESIN"
        ],
        [
          "H-CORE",
          "H-DUAL"
        ]
      ]
    },
    "intervention_family": "dual_axis_resin_modified",
    "measurement_id": "M-HOLD-120",
    "measurement_plan": {
      "measurement_id": "M-HOLD-120",
      "min_repeats": 2,
      "name": "matched-window 120 C thermal hold",
      "primary_observable": "SI_15_60 = (eta_60 - eta_15) / eta_15, percent",
      "protocol": "Hold the melt at 120 C. Record viscosity at 15, 30, 45 and 60 min. Report the 15-60 min matched-window relative change. Run at least two independent repeats.",
      "sampling_times_min": [
        15,
        30,
        45,
        60
      ],
      "temperature_c": 120
    },
    "minor_tackifier_like_pct": 5.0,
    "process_state_risk_detail": {
      "base_before_measurement_plan": 0.75,
      "measurement_controls_process_state": false,
      "missing_process_fields": 6,
      "risk_level": "moderate",
      "score": 0.75
    },
    "reactive_mass_fraction": 0.8,
    "resin_modified": true,
    "scientific_hypotheses_addressed": [
      "H-CORE",
      "H-RESIN",
      "H-DUAL"
    ],
    "uncertainty_reduction_detail": {
      "novel_chemistry": true,
      "novel_chemistry_factor": 1.0,
      "resolves_quantity": "isothermal time coordinate S_t",
      "score": 0.9,
      "unresolved_prior": 0.9
    },
    "voi_components": {
      "decision_relevance": 1.0,
      "extrapolation_risk": 0.0,
      "hypothesis_discrimination": 0.666667,
      "measurement_interpretability": 1.0,
      "process_state_risk": 0.75,
      "uncertainty_reduction": 0.9
    },
    "voi_score": 0.6925
  },
  "falsification_criterion": "Using the arithmetic mean of the independent-repeat SI_15_60 values, a mean SI_15_60 >= 7.61% falsifies H-RESIN's superlinear-suppression prediction and supports H-CORE at the registered resolution. Conversely, a mean SI_15_60 < 3.80% falsifies H-CORE's linear-dilution prediction; intermediate means do not decisively falsify either hypothesis. Neither outcome separates H-RESIN from H-DUAL.",
  "frozen_utc": "2026-09-20T03:07:17Z",
  "git_commit": "99373987221e4ee94f782ad821f6ee2e1463da34",
  "hypotheses_addressed": [
    "H-CORE",
    "H-RESIN",
    "H-DUAL"
  ],
  "hypotheses_left_entangled": [
    "H-RESIN",
    "H-DUAL"
  ],
  "hypothesis_registry_hash": "2117be1a410f050eb8e2f2d000d069907652494eec699005bb4e0b0e67a36175",
  "input_hash": "6a143148198d3879ebd38f0447fd884d21f4e702f66a7867ac907dfeccd0a952",
  "inspection_status": "frozen_pre_result",
  "measurement_catalog_hash": "75c54e09dd8b2a3c9ca231f1caea27b6d93a8628474733a0bf6b907f02dd3a92",
  "model": "gpt-5.6-luna",
  "next_experiment_if_falsified": "Run a matched acrylic-only 15.0% AC1920 composition with 0% TK100 using the same E2 reactive-core basis, 120 C M-HOLD-120 protocol, independently prepared repeats, recorded preparation history, and a common-temperature realized-viscosity anchor.",
  "primary_observable": "SI_15_60 = (eta_60 - eta_15) / eta_15, percent, measured at 120 C over the 15-60 min matched window",
  "prompt_hash": "dc47194bf7ce3750d07e210da66915795069387765d2e21135425989e32b3e59",
  "rationale": "S1C41 combines 15% AC1920 and 5% TK100 while preserving the E2 reactive-core proportions, giving a registered H-CORE prediction of 7.61% drift and a low-drift threshold of 3.80%. M-HOLD-120 directly observes the declared 120 C viscosity-growth failure mode without model fitting or extrapolation. The selection breaks the genuine top tie toward the minimum supported intervention while retaining discrimination of the reactive-core explanation from a low-drift combined intervention.",
  "recommendation_id": "EXP_V4_20260920T030717Z_86d4d46727",
  "selected_candidate_id": "S1C41",
  "selected_experiment_id": "S1C41::M-HOLD-120",
  "selected_measurement_id": "M-HOLD-120",
  "stage_disagreements_resolved": "I followed the Proposer and Robustness Adjudicator in selecting S1C41 because it is in the stable deterministic top tie, directly measures the least-resolved failure coordinate, and uses the smallest supported dual-axis modifier burden. I followed the Skeptic in restricting the interpretation: the result tests only combined composition-level suppression versus linear dilution, does not separate H-RESIN from H-DUAL, cannot establish a molecular encounter-frequency mechanism, and requires explicit repeat aggregation.",
  "uncertainty_decomposition": {
    "evidence_coverage_uncertainty": "The candidate uses both modifier axes within the supported regions, but the dual-axis design cannot identify whether acrylic-like modification, minor tackifier-like modification, or their combination drives suppression.",
    "extrapolation_uncertainty": "Low for the selected composition because 15% acrylic-like modifier and 5% minor tackifier-like modifier lie within the registered supported regions; external analogue evidence does not establish an exact local outcome.",
    "measurement_uncertainty": "The direct matched-window observable has a declared discrimination threshold of 2.00 percentage points; at least two independent repeats are required.",
    "realization_state_uncertainty": "M-HOLD-120 does not control realization state; prior 120 C matched-temperature viscosity realizations varied by up to 3.57-fold, so preparation history and repeat dispersion can confound formulation-level drift comparisons."
  },
  "voi": {
    "components": {
      "decision_relevance": 1.0,
      "extrapolation_risk": 0.0,
      "hypothesis_discrimination": 0.666667,
      "measurement_interpretability": 1.0,
      "process_state_risk": 0.75,
      "uncertainty_reduction": 0.9
    },
    "formula": "VOI = w_hyp * hypothesis_discrimination + w_unc * uncertainty_reduction + w_dec * decision_relevance + w_int * measurement_interpretability - w_ext * extrapolation_risk - w_proc * process_state_risk. Every component is normalized to [0, 1] by construction. This is a transparent normalized score with reported weight sensitivity, not a Bayesian posterior.",
    "score": 0.6925,
    "selected_is_in_tied_top_set": true,
    "tied_top_set": [
      "S1C41::M-HOLD-120",
      "S1C46::M-HOLD-120",
      "S1C51::M-HOLD-120",
      "S1C56::M-HOLD-120",
      "S1C61::M-HOLD-120"
    ],
    "weights": {
      "decision_relevance": 0.25,
      "extrapolation_risk": 0.1,
      "hypothesis_discrimination": 0.3,
      "measurement_interpretability": 0.1,
      "process_state_risk": 0.05,
      "uncertainty_reduction": 0.2
    }
  },
  "workflow_version": "1.2.0"
}
